date	business_id	review_id	user_id	stars	funny	cool	useful	text	name	address	city	state	postal_code	review_count	is_open	categories	longitude	latitude
2019-01-01T16:38:31Z	Sr_VUJBhqcKCDLRv0JkrDg	KyZCYM3QsxQWrTBZzwyBGQ	59pj3RyWS9nvJ6s2VgZUwA	1	0	0	1	Breakfast order was wrong.  Both coffees we're room temperature, tasted old, and we're not made as ordered.  Muffins weren't toasted but we're cold and soggy.  Hash browns were cooked in old oil.	McDonald's	1650 Copley Rd	Akron	OH	44320	5	1	Restaurants, Fast Food, Burgers, Coffee & Tea, Food	-81.5813845878	41.0841590818
2019-12-10T21:49:09Z	QzpdN_I4B_A6b5PzPIUchA	nLWP2MZMNd4xcbgn-JZw3w	FJRa4m-BBBQJv0UiSolVjg	2	0	0	1	I tried giving it another chance... when will I learn to check my order before pulling away from the drive-thru. Shorted a Big Mac that I discovered when I got home.... done with this location. Serious quality issues	McDonald's	500 Leavitt Rd	Amherst	OH	44001	25	1	Burgers, Fast Food, Coffee & Tea, Restaurants, Food	-82.2101153433	41.411874957
2019-09-20T00:38:12Z	QzpdN_I4B_A6b5PzPIUchA	UbY2mAZ6dVJCoaPKRPF64A	_n6GfNAx5LHtKeSY1xKmSw	2	0	0	2	"Playplace VERY dirty. I'm amazed my grandkids haven't gotten sick here. The management is not any better. What has happened to McDonalds?!
Only getting 2 stars because the food isn't horrible. For a while the toilet in the playplace flushed continuously, and the last time I was there, it had an out of order sign on the door."	McDonald's	500 Leavitt Rd	Amherst	OH	44001	25	1	Burgers, Fast Food, Coffee & Tea, Restaurants, Food	-82.2101153433	41.411874957
2019-03-28T21:10:53Z	WB1albu5FvNP16BAtTIIVg	ZZQat_5kW9vopRvgtwEfZg	pSb5G6bdLIg46WF4YlVEzw	1	0	0	0	If you chose to go here you will sit in the line at the drive thru for a good half hour, good luck	Wendy's	1015 Ohio River Blvd	Avalon	PA	15202	18	1	Restaurants, Burgers, Fast Food	-80.0635987	40.4940917
2019-06-22T16:38:28Z	hZ79bbzGuiU0ThbasNEALQ	JUOghAaCfwDPZc6nuxMUyg	I4wplanZZZbL7rYPA7RVrQ	2	0	0	0	Let's be honest, McDonald's these days seem to be deteriorating quite rapidly. When it comes to a typical fast food joint, I don't typically write a review unless it was a really terrible experience and/or meal. I woke up this morning groggy as all hell. I just wanted a frappe and a hash brown to perk myself up. My boyfriend came along and got some food too. The drive through was super packed, so we just parked and went inside, we assumed it would be quicker. I got my frappe and hash brown, my boyfriend got a Big Mac meal and two mcchickens (he's a big guy). Our food took a solid 15 minutes before it was ready to go (we ordered our food to go). My boyfriend said the Big Mac was so dry that he needed to take a drink of his coke after each bite. The fries and mcchickens were good however, he said. The thing that probably annoyed me the most was that as soon as you walk in, there's employees and people standing in the doorway, preventing anyone from being able to walk through the door without asking everyone to move. There wasn't even anyone in line, just a bunch of people standing around (mostly employees) and being so loud. Not to mention there were two small children that were under 3 years old running around the entire restaurant, including the back kitchen! This was the most infuriating because that's totally dangerous! The kids were pretty obviously one of the employees because 3 of the employees kept picking up these kids, attempting to keep them from going in the back. I'm seriously appalled by all this. Under no circumstances should an employee have to babysit their child while at work, especially when you work at a fast food place. Just take the day off? What would happen if one of the kids wandered all the way in the back and touched the grill, or got burnt from fryer oil? Why if an employee was transporting hot food and didn't see one of these kids coming and tripped over one of them and everyone got hurt? Unbelievable! I do not think I will be returning to this McDonald's again! Food was just okay, staff was a mess, and almost all of the tables looked filthy! Cmon McDonald's you're better than this.	McDonald's	363 Perry Hwy	Pittsburgh	PA	15229	13	1	Coffee & Tea, Food, Restaurants, Burgers, Fast Food	-80.0293178149	40.5175797044
2015-08-15T13:43:45Z	riOcJNKde7ZpkH_n7HtZ5w	cJAddZ8Zi4TutKsGJj7Kzw	803dzQ0QpWfWoKtZcScCHw	1	2	0	2	Time and time again I come home from McDonald's on royalton with the wrong or missing items. How hard can it be?  So disgusted with that place!!	McDonald's	5304 Royalton Rd	North Royalton	OH	44133	8	1	Burgers, Restaurants, Food, Coffee & Tea, Fast Food	-81.7227438	41.3144333
2019-06-15T14:05:55Z	riOcJNKde7ZpkH_n7HtZ5w	ea4oBRAkwQPyc7rHgkgh8w	xdigxxG29QEjY24sWfT1lA	1	0	0	2	This particular McDonald's used to be a well oiled machine. Lately whether due to new ownership or management it is horrible. Cars parked all over to get food, people screaming out of their cars because food not being brought out, orders are usually wrong. Complete embarrassment	McDonald's	5304 Royalton Rd	North Royalton	OH	44133	8	1	Burgers, Restaurants, Food, Coffee & Tea, Fast Food	-81.7227438	41.3144333
2019-11-30T20:01:36Z	WB1albu5FvNP16BAtTIIVg	eKI4MSfXLVgTWlpK2ydF4w	xKFkcJwlTiseJs267qlMPA	1	0	0	0	I ordered a son of baconator, and I opened it and there was one piece of bacon on it. I took it back and the baboon who cooked it was unable even to make me a second one. The second one had a hard bun with burnt bacon. I told the moron at the counter that this is the best I could possibly hope for and left. Who trains these people? They literally could not find their ass with both hands.	Wendy's	1015 Ohio River Blvd	Avalon	PA	15202	18	1	Restaurants, Burgers, Fast Food	-80.0635987	40.4940917
2019-05-12T02:41:22Z	QzpdN_I4B_A6b5PzPIUchA	RfWGu5F0k6jakq9Ix6wdNQ	xFQMVZTtulGiNd7tRtJ-Sg	2	0	0	0	"Quite possibly the dirtiest McD's I've ever been to. My daughter & came here a few weeks ago & the kids play area was absolutely filthy & smelled really bad. 

On a positive note I've had some of the best quarter pounder with cheese sandwiches at this location. Seems midnight is the best time to go for fresh & hot food. 

Clean up & disinfect the children's play area for a better review."	McDonald's	500 Leavitt Rd	Amherst	OH	44001	25	1	Burgers, Fast Food, Coffee & Tea, Restaurants, Food	-82.2101153433	41.411874957
2019-10-24T00:37:49Z	riOcJNKde7ZpkH_n7HtZ5w	8sQzgMBXzpce77o5mlgSbQ	Q6hY3FRllY-XEyUi2RDJig	1	0	0	0	"I went here tonight.  I got home and was eating my burger and it wasn't even cooked at all.  I called and spoke to a
Manager and she told me "sometimes the grill doesn't cook it all the way through"!!! Seriously lady!! It was the human cooking it that didn't cook it.  She didn't even say we'll give you another one or make good for it she just made up bullshit excuses and sounded like a complete idiot.  And when I asked her name because I'm calling corporate she said "I don't have to tell you". I've had other issues here before but this was it!!! DONT GO HERE!!!"	McDonald's	5304 Royalton Rd	North Royalton	OH	44133	8	1	Burgers, Restaurants, Food, Coffee & Tea, Fast Food	-81.7227438	41.3144333
2017-09-29T18:32:02Z	hZ79bbzGuiU0ThbasNEALQ	YoeH4vIZtW7ye2ObKWXcQg	hg71CGHy9bwpgY8cGVVg4w	2	9	10	12	"I was in the area and decided too stop quick for a bite too eat.
I sore a huge line at the drive up so I decided too go in instead.
That was probably as big a mistake as it would of been to stay on drive thru line.
I was 2nd in line walking in and it took literally 10 minutes for them to get to me to take my order.
Shame on you guys terrible customer service and extremely slow.
They seemed too be taking the drive up orders first then the walk ins.
There where more employees working on the drive up window than inside which there was only one cashier.
I ordered two hamburgers with extra pickle and a large fry.
The only positive thing I can say is the order was correct and the food was the same as every other McDonalds.
I would not go too this McDonalds again unless I saw that there was no line on the drive thru.
Ridiculous waiting almost 20 minutes too order and get food in a fast food place."	McDonald's	363 Perry Hwy	Pittsburgh	PA	15229	13	1	Coffee & Tea, Food, Restaurants, Burgers, Fast Food	-80.0293178149	40.5175797044
2018-11-25T14:51:13Z	riOcJNKde7ZpkH_n7HtZ5w	si9NM8i55JMuNFsAH-7JIg	ZfkC-A6XWO5Uc1uSKT9x-w	1	2	1	4	I come here everyday for coffee and sometimes breakfast but 90% of the time my food order is WRONG. I am almost convinced this location only hires idiots. Today I had to finish my drive thru order at the pay window because the girls were too busy laughing a goofing off to answer me on the speaker...	McDonald's	5304 Royalton Rd	North Royalton	OH	44133	8	1	Burgers, Restaurants, Food, Coffee & Tea, Fast Food	-81.7227438	41.3144333
2019-07-17T10:28:25Z	_4-kSAZ1qopE2GcMojLxzg	jfiNDjCxtjSHEnur0qvJdA	M820N-2yyFxP2otbx4kdcA	1	0	0	1	My experience of this Burger King is that everyone wants to be in control,  I requested to speak with the Manager and while I was talking with the Manager the cashier was talking the whole time.  It was  a very minor incident  but was blown out , Here's what happened , there was a sign next to the order board that stated Cup or Cone for .75. Both the Manager and Cashier could  only repeat what a Advertising Promotion stated , meaning Even as I explained to them that there was a Sign next to the order board that was lit up he tried to convince Me otherwise.  Now get this , I stated that they need to honor the price which was a difference of .25, cashier still said 2.00. Now I'm on principle of the matter now, after driving back around showing the Manager the sign all I get was , You're right.  He found a sign in the dark that you couldn't even notice to try to prove his point.    I won't go back but if you do  insist that they should honor all posted Promotions.    Just crazy!!	Burger King	414 Water Street	Chardon	OH	44024	5	1	Burgers, Restaurants, Fast Food	-81.2106144	41.5812817
2019-10-12T16:24:04Z	Sr_VUJBhqcKCDLRv0JkrDg	c3AU9H_PG6P9QV8TJ2Phig	43Hn0CqNSkCLIq4wcbHb5Q	1	0	0	0	A bunch of stupid motherfuckers working in here. Fuck this place man. 15 fucking minutes for a fucking mcchicken and fry???? With every motherfucker that ordered after me getting their shit first?  I made the fat bitch manager give me a refund.. a fucking joke!!!!	McDonald's	1650 Copley Rd	Akron	OH	44320	5	1	Restaurants, Fast Food, Burgers, Coffee & Tea, Food	-81.5813845878	41.0841590818
2019-04-21T14:22:47Z	WB1albu5FvNP16BAtTIIVg	F1Nu9TrPc6EiHCs6ED4PBQ	V0CMr3WfYngnumM_cZ4hsg	1	0	0	0	The entire staff is ghetto slow and ignorant. I don't recommend this Wendy's at all I would definitely go elsewhere.	Wendy's	1015 Ohio River Blvd	Avalon	PA	15202	18	1	Restaurants, Burgers, Fast Food	-80.0635987	40.4940917
2019-10-09T19:22:07Z	INsBi18bVl4UNqRcGzAkLQ	nW4uTzQSeBCbQVck2u5QgQ	qVQ3ziVCpYAFwxrDfmjLrQ	1	0	0	0	Been sitting in the drive thru for 15 minutes!  Slowest service at a McDonald's ever!!!	McDonald's	11420 Buckeye Rd	Cleveland	OH	44104	9	1	Burgers, Fast Food, Food, Coffee & Tea, Sandwiches, Restaurants	-81.6047511902	41.48092
2018-11-25T21:45:42Z	Sr_VUJBhqcKCDLRv0JkrDg	xDuHm7tkd9PgyjjVxNQd6g	43Hn0CqNSkCLIq4wcbHb5Q	1	0	0	0	"Worthless.


Rude workers that happen to also be incompetent. 

Cannot understand spoken English through the drive thru (not sure what the understand? Profanities perhaps?) and cant get a damn order right. 

A disgrace."	McDonald's	1650 Copley Rd	Akron	OH	44320	5	1	Restaurants, Fast Food, Burgers, Coffee & Tea, Food	-81.5813845878	41.0841590818
2014-12-06T01:55:06Z	I79WiJ-7Xkufc392qH77ag	VRIQWu6LH-5g4xbtTw1Z0A	Jvnagx8GYWB6ywoK6sD-Og	1	1	0	1	BK stands for Bi-polar Kondition.  I've been here when it was staffed by old ladies who were slow but made EVERYTHING fresh when you ordered it (not fast but oh so tasty!), and later there were unusually attractive teen girls who were SO slow to dish out cold, stale food.  If you're waiting to place your order at the sign for more than 8 minutes - just pull out and drive away. The last three visits were so bad I'll probably never go back.	Burger King	9535 State Route 14	Streetsboro	OH	44241	5	1	Restaurants, Burgers, Fast Food, Hot Dogs	-81.3568302	41.2441662
2019-05-29T15:20:32Z	WB1albu5FvNP16BAtTIIVg	MoXOMaNH8fKmhZac74Gb5w	Wm06mVXzyoPH845twdKRoA	1	0	0	0	Easily without question one of the if not worst Wendys i've ever been to. The only reason i kept going back after my first time because it's the only one that's close to where i live. Every time i order i get the same thing (Crispy Chicken 4/4) and i don't think i've waiter shorter than 10 minutes every time. from the lack of work ethic from the employees and just the employees being incompetent in general, not to mention they tend to act a little more ghetto then they should. You can be sitting there for 15 minutes and ask them where is your food and they'll all just look at you and start laughing when what's really funny is they  can't put together 3 small food items and a drink quicker then 15-20 mins. avoid this wendy's at all costs your better off going to the Mcdonald's or Burger King that is Right near this one because you won't have to spend nearly as much time in there	Wendy's	1015 Ohio River Blvd	Avalon	PA	15202	18	1	Restaurants, Burgers, Fast Food	-80.0635987	40.4940917
2016-10-01T01:21:47Z	WGO02-cLiWjeJh0PPLQMBw	TkugNXs6kj2VWosIl9PUXA	V98rLmv136IriuGkgGC5tw	1	0	0	0	Ordered a single burger w nothing on it except for pickles, milk, a medium frosty.  As the order was  repeated back Asa cheeseburger.  Corrected and said I wanted a plain burger w pickle.   Got to the window, I mentioned the milk was not received, was told not charged so paid separately.  Got home, I had a single cheeseburger w mayo and a pickle.  What part of plain hamburger did the order taker not hear.  Won't visit here again.  Snotty employees.	Wendy's	27400 Chagrin Blvd.	Orange	OH	44122	20	1	Fast Food, Breakfast & Brunch, Restaurants, Burgers	-81.4859401	41.462061
2017-06-28T15:27:30Z	WGO02-cLiWjeJh0PPLQMBw	jrVnVd--t_8qerAxFOhGXQ	f4ZDB81iBDqk4UmOKgB5Jg	1	0	0	0	Terrible service. Because of my job this place is convenient but very frustrating. I always have to constantly repeat my drive thru order. Usually the person taking my order appears listless and mumbles an incoherent response. Check your order for a straw, plastic utensils or napkins.	Wendy's	27400 Chagrin Blvd.	Orange	OH	44122	20	1	Fast Food, Breakfast & Brunch, Restaurants, Burgers	-81.4859401	41.462061
2016-03-18T01:32:51Z	lG4NNpcPWYSmLKEfBagnTw	xNcjvv8A0i-sJfZRMoOmBw	6uLqCFKpK7nav7Zp_3TfRA	2	0	0	0	Not able to get my annual shamrock shake fix as their shake machine is currently out of commission.  :(	McDonald's	2051 W Broadway	Monona	WI	53713	19	1	Food, Coffee & Tea, Restaurants, Burgers, Fast Food	-89.3490359187	43.0465419315
2014-02-25T18:21:58Z	P8ersCaJqnL1paY9FFnZ9w	lQUyYFbmcGoNw0LaiNQtDA	3EYfeP-wfNWGj-5YZmq-OA	1	0	0	4	"Remember when Burger King was actually somewhat decent?  Pepperidge Farm remembers...

I have dined with the King many a time across this fine land.  I have watched their slow decline with sadness over the last thirty years.  At one point, they actually challenged the Clown for burger superiority, but now, they're a weak shadow on the market, barely a player...

...and the BK at this location is a perfect example of why.

EVERYTHING at this BK takes ten minutes.  Doesn't matter what you order, be prepared to wait.

It's always dirty.  When I was a kid and worked at the Clown, we were always cleaning.  There was usually one or two people on any shift whose sole job was to keep the lobby clean.  This place is a hole.

Why does the food taste weird?  If I want BK, I actually make the drive to Deforest, rather than eat at this location, which is actually a stone's throw from my house.  The food here tastes bad, bleachy, and wrong.  What are they doing to the food?

Fix thyself, King, and maybe I'll return.  Until then, I will take my cheap, poorly constructed eats elsewhere."	Burger King	822 Windsor Street	Sun Prairie	WI	53590	37	1	Burgers, Restaurants, Fast Food	-89.2271823	43.1879489
2014-10-12T19:54:14Z	ev4frBEgYDHiNZPcdYAIbA	XIFsLk6sTpiK-ee4lrixJQ	m-oKpfJaX8fHFf-vlXZldQ	1	0	0	0	"This is an older McD's.  It's easy on - off if traveling from the airport.  I think the drive - thru is open till midnight.  Which might be the better way to get something here.  I was
harassed in the parking lot by a man in a late model, red, SUV on Fri. Oct 3rd about 8pm like a Ford Explorer or similar.

This place probably lost alot of business to the Chipolte in the next plaza over.  Since
most people want to live as healthy and long as possible.  
So not Eek!.  Just One Star."	McDonald's	250 Summit Park Dr	Pittsburgh	PA	15275	4	1	Fast Food, Burgers, Coffee & Tea, Food, Restaurants	-80.176387	40.447262
2017-01-17T00:23:57Z	WGO02-cLiWjeJh0PPLQMBw	OirtV32MwTxdJ0ikpUINQg	ByOcLSyfjiUh22Gy-nJspQ	1	0	0	0	They totally screwed up my order, wrong drink, no fries, and I was charged for it all.	Wendy's	27400 Chagrin Blvd.	Orange	OH	44122	20	1	Fast Food, Breakfast & Brunch, Restaurants, Burgers	-81.4859401	41.462061
2014-07-28T21:05:50Z	P8ersCaJqnL1paY9FFnZ9w	c6lxZQBbRNGso_pqaDfIpg	cDiVdEdtgFNdruZR94XQxA	1	0	0	2	"This is my least favorite Burger King in the entire world. I ate there once a year ago, and the fries were old and cold, and tasted like an entire bag of salt was dumped on them. The burger was bland, except for the taste of salt. Even in a small town (Sun Prairie), the parking lot somehow manages to get swamped with diesel fumes--must be the wind blowing off Highway 151.

I decided to try it again today, wondering if it was just a random bad experience. No. They made fresh fries, and so I didn't mind waiting 15 minutes at the window. The guy behind me in the drive through looked like he minded. I had the opportunity during the extended wait to notice that all of the cars behind me were driven by the truly obese--with fat billowing out of their shirts, with faces that became chins that became torsos, without a clear definition of where one stopped, and the next began--extreme, even for Wisconsin.

The fries were fresh, and salty to the point that my gums hurt. The burger completely fell apart, and was bland, except for the overwhelming taste of salt. The bread was stale. I guess that was a second flavor, that I could taste through the salt. So the Whopper tasted like salty, stale bread, which disintegrated, somehow appropriately.

I realize I'm being a drama queen, but I drove home and took a shower."	Burger King	822 Windsor Street	Sun Prairie	WI	53590	37	1	Burgers, Restaurants, Fast Food	-89.2271823	43.1879489
2014-01-19T19:34:50Z	P8ersCaJqnL1paY9FFnZ9w	fJRpwEvS6uOGzmnz1s72kg	ohB1HjY0p1QsUZcD-i2O0A	1	0	0	6	Unless you like being ignored, Avoid, Avoid, Avoid! Stopped in for lunch today and the place was pretty much empty. There was a lady waiting at the counter for her order, two gentlemen who already had their order and were seated and eating. There was one worker for the front counter and the drive thru and 2 or 3 workers in the back. Waited over 10 minutes for someone to take my order and wasn't even acknowledged in that time. One of the guys came up front to bag drive thru orders, wiped the sweat off his face with a napkin, crumpled it up, tossed it in the trash and then scooped up fries without washing his hands. At that point I walked out and went to Culvers where I ordered and got my food in less time than I spent waiting to order here.  Not even worth one star!	Burger King	822 Windsor Street	Sun Prairie	WI	53590	37	1	Burgers, Restaurants, Fast Food	-89.2271823	43.1879489
2014-01-19T18:37:38Z	P8ersCaJqnL1paY9FFnZ9w	DZzmIwgImn39ff-pULmWSQ	RIIgnObgC-8l-x-8b4GGZA	1	0	0	3	Have been there several times and it's always super slow. It had been months since we had gone there so today we went there and the girl at the counter just finished a counter order, saw us, and went to drive through. We stood there for 15 minutes waiting for somebody to take our order. Fed up, we left and went to Culver's.	Burger King	822 Windsor Street	Sun Prairie	WI	53590	37	1	Burgers, Restaurants, Fast Food	-89.2271823	43.1879489
2016-08-07T02:22:47Z	lSJYTotaOEi1TtEzxbbUxg	hQktQB-gTfUgWEjjAtR_BA	9O86UOX2knQcMO2MNhiARQ	2	1	0	0	The slowest McDonald's I have ever been to. Dirty too. 1 register open. 7 people in line... 8 cars went thru the drive thru before I even got to the counter to order... close this dump and put a KFC here	McDonald's	4738 Ridge Rd	Brooklyn	OH	44144	6	1	Restaurants, Fast Food, Food, Burgers, Coffee & Tea	-81.73491	41.426362
2018-09-16T03:50:19Z	LjjfsPpNEyHHouAyirPJcQ	DafVAIIaoLSQBulUkS3qPw	dIxjHuAs3O1QymwLghc3pA	2	0	0	0	Good burgers.Broken down pop machine that is often out of ice. Burger Fi internet is slow or down. Poor desserts.	Burger King	605 East Main Street	Kent	OH	44240	3	1	Burgers, Restaurants, Fast Food, Hot Dogs	-81.34961	41.154171
2017-01-05T02:12:56Z	P8ersCaJqnL1paY9FFnZ9w	jGY-2rpB5piA5gpIteH5-A	-h7Hq0oK8DS1i4zDpR9Myw	1	0	0	1	I drove to Sun Prairie today to get a Whopper since the Madison BK's are so horrible. I found the Sun Prairie one just as bad. Why is it so difficult to apply the condiments so the cover the burger rather than just one edge of it? Those things are thrown together and when you try to eat it, you find nothing is even close to the center. I've been going to BK's for many years. I just visited one in southern Illinois that was wonderful. Why are the ones in the Madison area so horrible? I guess it boils down to lousy managers.	Burger King	822 Windsor Street	Sun Prairie	WI	53590	37	1	Burgers, Restaurants, Fast Food	-89.2271823	43.1879489
2018-03-07T21:14:04Z	Aua2Vi32K-G4LE0JCtAwiw	1dcR2XpEAC_6vOjCDh9ZWA	c3S-CHZH7r-jeAmevLo89g	1	0	0	1	If you want fast and the correct meal, don't come here. It has gotten worse over the last few months. At night the crew doesn't watch the drive through. Today going through the drive through I tried to get them to correct order before I went to the window. But no, didn't happen. The girls at second window were having fun between them not paying attention. Friend we're awful, over salted. Never had a bad fry at McDonalds in my 56 years of life until today. We will not return here.	McDonald's	2901 Dryden Dr	Madison	WI	53704	19	1	Coffee & Tea, Burgers, Fast Food, Food, Restaurants	-89.3588528037	43.1284709106
2014-03-17T02:18:32Z	P8ersCaJqnL1paY9FFnZ9w	bGtVG_fO3YO74BLoSSHlYQ	eLRBlTf_3oTAIOuQ4F30rw	1	0	0	2	This place is slow beyond belief. How do they stay in business? I waited 15 min for my order which was wrong and cold. I got the excuse "were short staffed". There were two cars in line and no one in the dining area. How much staff do you need for two customers? I think they laugh about how bad they are as workers. Because they could care less....	Burger King	822 Windsor Street	Sun Prairie	WI	53590	37	1	Burgers, Restaurants, Fast Food	-89.2271823	43.1879489
2014-02-12T17:51:43Z	GDylnjwPm2fcqT8FgG7gJg	rjEE_VoML6IQgmGLNHqYOQ	zODQ3-jqML5iosC5vzQNiA	3	1	0	0	"This is a better McDonalds then most of them
Little less corporate feel then most
Still a McDonalds 
Drive thru is at window talking to a real person while ordering (I kinda like this aspect) 
They always just like the others try to get out of coupons 
I love old lady's but the ones here are just a little to mean for my taste
But can't blame them I guess
Just how Mcdonalds is
It is clean 
I would like a option for paper towels in the bathroom though I don't like to touch the door handle when leaving  any bathroom
Most stars I could give any McDonalds
So go if you must"	McDonald's	12 Munroe Falls Ave	Munroe Falls	OH	44262	11	1	Food, Restaurants, Coffee & Tea, Fast Food, Burgers	-81.4396628737	41.1396584862
2017-08-20T17:33:12Z	Aua2Vi32K-G4LE0JCtAwiw	rfzWdEP3kS4jomo6Hu3r4A	MeXXCvrMNbc7Zd2E_tiE2g	1	0	0	0	This is probably the worst McDonald I have ever been to. When you go to McDs you know what to expect. You aren't going to get a gourmet meal. What you do get is OK food quicky at an OK price, quickly. This McDs just can't seem to hit any aspect of the service side. We sat in the drive thru waiting our turn for nearly 10 minutes. It's a double lane, so there were 4 cars in front of us when you count both lanes. Then it's our turn. Except the lane next to us keeps having their orders taken. Two more cars get in front of us. Still haven't taken our order. We finally backed up and left. Will never go here again. We should know better. The last time we stopped here theye couldn't get it right either. Too many other options to put up with crap service. Won't bother again.	McDonald's	2901 Dryden Dr	Madison	WI	53704	19	1	Coffee & Tea, Burgers, Fast Food, Food, Restaurants	-89.3588528037	43.1284709106
2016-07-08T02:36:23Z	W9FpILKWwGP9Ub19CtqGXQ	rp0Ylo3sDXxvrdAHKXT-GA	PJ6LYU0111nU6ybRktbdpQ	1	0	0	0	"This particular store is a little further away than others but we are often coming home from kids' games and have to hit them up. They simply can't get orders right. We have cheese allergies in our house and no matter how we emphasize this point, for the second time in a week ( and pretty consistently over the years) they mess up the order. The slip taped to the box even says "no cheese" but the staff just doesn't seem to care. And returning the food at 10:00 pm to a restaurant miles away is a no go. I know it is just fast food, but what else should they be measured by? Food safety and order accuracy...that's it. 

I have never posted a Yelp review. I revived my account tonight."	McDonald's	14841 Snow Rd	Brook Park	OH	44142	4	1	Fast Food, Restaurants, Food, Coffee & Tea, Burgers	-81.7997938476	41.4036973097
