date	business_id	review_id	user_id	stars	funny	cool	useful	text	name	address	city	state	postal_code	review_count	is_open	categories	longitude	latitude
2013-12-14T03:25:14Z	6qAChWfCZVDvXNtcyhze-g	64QjrMlGXqwgItb4Nt0ypw	M9TjYmTgHayJ22cNkyvW_g	1	2	1	4	"You know it's bad when a McDonald's gets a 1 star review...I mean, seriously: none of us expect anything fancy when we go to a McDonald's. The whole point of going to McDonald's is indulging in some not-good-for-you food on the go in your busy life. In my case, I just wanted a small meal/snack that wouldn't cost me as much as the stuff in Kennywood would. I hadn't even eaten at a McDonald's in about eight years or so. And I quickly remembered why!

Forget the fact that McDonald's food isn't great. We all know it's not great. The problem here is that they added insult to injury by giving you the worst customer service ever in addition to not so good food. For starters, I quickly discovered that the drive-thru here is the ABSOLUTE slowest line on planet Earth. You certainly won't be getting any fast food here! Then, once I FINALLY placed my order, and finally got to the window to pay (because of course I spent a lot of time waiting for the people in front of me to even get their orders), a young woman took my card, swiped it...and didn't say another word. I waited thinking she was printing a receipt - nope! Eventually - after whipping out her phone and sending a text or two - she realized I was still there and told me to go to the next window for my food. Whatever, I figured, forget the receipt; by then I was pretty sure she had moved on to other orders and couldn't print my receipt anyway. On to the next window, where I was given my food and drink...and I proceeded to quickly discover they gave me no straw and for some reason, layered my Big Mac as such: bread, bread, patty, patty, bread. ...seriously, how does one even mess that up? I give one brownie point because the fries really were actually pretty good...but they were not worth the wait or trouble.

I concur with the other reviewers: skip this place. Completely. Just keep driving. Anywhere else is better and less of a waste of your time and money, and the people here are so slow that you'll spend more time waiting for your food then you will eating it."	McDonald's	101 Hoffman Blvd	Duquesne	PA	15110	16	1	Food, Fast Food, Coffee & Tea, Burgers, Restaurants	-79.8632582277	40.3842109294
2019-06-21T17:57:20Z	6qAChWfCZVDvXNtcyhze-g	QjITcLYIDDoqKfTeRAbjnQ	uofZibtxxOjal5vMXp-kQw	1	0	0	0	This McDonald's got me FUCKED up. Never open, lets customers wait in line for over 20 minutes, not too mention also RUDE to customers that WAIT 20 MINUTES. Go somewhere else. This place deserves to be shut down.	McDonald's	101 Hoffman Blvd	Duquesne	PA	15110	16	1	Food, Fast Food, Coffee & Tea, Burgers, Restaurants	-79.8632582277	40.3842109294
2019-12-03T05:49:17Z	C8jxaI_NmVpINEy0JquNZw	t8GN2pk16sv9UHf08sA_Yw	8nuMNfuTy0yUjExcGW1XUQ	1	0	0	0	I went thru the drive thru line lane and ordered a quarter pounder with cheese meal. Was asked to pull up to the next window to wait a few extra minutes for my meal. I waited about 20 min. but was fine with it since I was in no rush. I go home and eat to find out my burger was uncooked and forgot the cheese. Ever since they've reopened, this locations service and food quality has been pretty bad. I'd rather take the extra time to go to the Howe ave. location	McDonald's	1787 State Rd	Cuyahoga Falls	OH	44223	15	1	Fast Food, Burgers, Food, Restaurants, Coffee & Tea	-81.5077091753	41.1310837
2019-11-26T01:19:32Z	KU6EYISdKH-jw3w7vZa6Pw	OYQeq-r5g6mTqiV_u9VNJw	NmLZ1sVB9gZTQBlqObfQ3Q	1	0	0	0	horrible location!!!! they have one speed.... slow!! slow af!! i don't care what time of day it is.... they move at a snails pace and thats an insult to the snail!	McDonald's	15110 Saint Clair	Cleveland	OH	44110	7	1	Food, Fast Food, Burgers, Restaurants, Coffee & Tea	-81.575911	41.5527029982
2019-07-12T05:06:09Z	JIxA9BaEjidsv3TYOi-HOg	svgO2JOgQ7CGQ7rrZYYgjg	12dikbBZKpwCb8OO3ac5-g	4	2	3	4	It's another burger place that is pretty good.  If you don't know what you are looking for you will walk right past it! The sign is on a weird angle of the building and there is just a small green burger logo on the front. We tried a few things...the smoke house burger, really tasty and has a little zip. The Chicago style dog, I like that they butterfly it when they grill it and it's loaded with toppings. Get a side of cheese with the crinkle fries. Was it all good yes! Am I going to choose to run there when there so many options downtown, not so sure.	Shake Shack	601 Euclid Ave	Cleveland	OH	44113	40	1	Fast Food, American (Traditional), Restaurants, Burgers	-81.689174	41.500334
2019-12-06T05:25:47Z	JIxA9BaEjidsv3TYOi-HOg	cZ-S8cO9J0c76-KNENB25g	p4Qp4QQ0-NwcXRpfboG3Og	4	1	1	1	If I order from here it's for work and typically order for 4-6 people. I've had a great experience so far with the mobile order app. Speeds the whole process up. Parking is an issue though. If you're not able to walk there I wish they had spots available out front or would validate for the garage next door. That's my feeling. Food is high price for the size but it's the quality you should be paying attention to. Good place... bring your friends and coworkers.	Shake Shack	601 Euclid Ave	Cleveland	OH	44113	40	1	Fast Food, American (Traditional), Restaurants, Burgers	-81.689174	41.500334
2016-04-22T02:33:12Z	NIFrjfEot4GFR-tqiqrsHw	0RVCecT4bdBtPRJVA0Ncyw	mhg4cvkpJnuapN4xLhEIkg	1	1	0	4	"EVERY single time I come through here, they mess up my order. And I mean EVERY TIME... If it wasnt so close to where I live and convenient on nights where i dont feel like cooking or speding alot of money,  i'd drive to belle vernon instead of coming to this dump. 
My boyfriend always order a burger plain, with just cheese, and it never fails that they load it up with everything anyway, or even better, they realize they messed up, and then scrape all the condiments off, leaving a ketchup soaked bun that tastes like onions, rather than just tossing the bun lid and grabbing a new one. 
Tonight when we came here, my boyfriend returned his burger to the counter (as usual) and told the girl that he ordered plain. He politely showed her the ketchup soaked bun and she said "ok no problem" and went to the cook and showed him. The kid cooking grabbed the burger and screamed "it is plain!" Not realizing my boyfriend was standing at the counter and could hear every word. The cook started tearing the burger apart layer by layer, yelling that it was a plain sandwich, and he stuffed it back in the box and shoved it at the girl and said "give it back to him". The poor girl had no idea what to do, so she went and got the manager herself. In the meantime, my boyfriend tried to explain to the kid cooking that the bun was saturated and almost dripping with ketchup and the kid replied "that's not my problem". 
It took every ounce of patience and biting my tongue not to completely snap. Luckily the manager grabbed him right after she made my boyfriend a new burger and told him they had to have a talk. Hopefully for all future customers sake, he will be fired."	McDonald's	301 West Main St	Monongahela	PA	15063	6	1	Fast Food, Restaurants, Burgers	-79.9254459	40.2029587
2018-11-18T16:33:09Z	uznSXfPkJgntadZ4gKHSoQ	ugtNi5TWzsAuWF6r_wTD0Q	GxZHSmK1QVokkGne5r4C_g	3	0	1	1	The service was good but I got the wrong drinks. Like are you kidding me. Like how hard is it to make a drink right. It must me very hard cause they always seem to get it wrong. I'm over it. I will no longer be coming back here. They are all stupid. I don't care anymore	Wendy's	14944 Pearl Rd	Strongsville	OH	44136	5	1	Burgers, Restaurants, Fast Food	-81.8358484	41.3069005
2019-04-06T16:27:04Z	atu9bo2flyoM3CzihE-OlQ	3WvgTw3dp3xz17Bo_BpQtA	C7gKJKUQt9MZEqtIkfzoPg	1	0	0	0	Just the drizzled poops. First the cashier spills my Frys all over the pay counter. Then proceed to scoop them up with bare hands and out them on my tray for me. That was my order of fries no replacement with non fingered up fries. The I noticed she only gave me a half a cup of small chili.	Wendy's	1660 Cochran Rd.	Pittsburgh	PA	15220	22	1	Fast Food, Restaurants, Burgers	-80.062159	40.392738
2019-07-08T19:16:47Z	atu9bo2flyoM3CzihE-OlQ	QSQ7e-C0dk3psOMfxYBxNA	zfk7l2aOZKoAh05OoXRTwQ	1	0	0	0	I couldn't get service here. Waited for five minutes, was acknowledged at the two-minute mark. After reading some reviews here, I waited another two minutes and decided it wasn't worth the wait. There was maybe a ten car line outside also waiting. A menu item was out of stock according to a sticker across the menu board. I left and went next door for my fast food fix. Taco Bell had modestly better reviews. I got service there right away.	Wendy's	1660 Cochran Rd.	Pittsburgh	PA	15220	22	1	Fast Food, Restaurants, Burgers	-80.062159	40.392738
2013-07-03T07:16:36Z	NIFrjfEot4GFR-tqiqrsHw	AJaui5_47XQHBmFibM5R1A	8ry4atEgXsi28sKFDGiVVw	1	0	1	3	"Frankly, the only reason anyone stops here is because they have a monopoly on fast food in town. If you put any other fast food chain up against McDonald's in Mon City, perhaps things would be better. They are slow, frequently mess up orders and often rude. 

Truly terrible. I don't know why they've been allowed to monopolize this town's business, but it's gone on for far too long!"	McDonald's	301 West Main St	Monongahela	PA	15063	6	1	Fast Food, Restaurants, Burgers	-79.9254459	40.2029587
2019-08-15T23:04:04Z	JIxA9BaEjidsv3TYOi-HOg	efjYVmcnlFOMvSZDXYVlyw	_DuT53_-Cs2t8h9UVe6VtA	4	0	1	1	Visited for the first time on August 3, 2019. I'd been told this was similar to Five Guys and it is a pricier version. Staff was friendly, food was delicious and the restaurant was clean. We will be back.	Shake Shack	601 Euclid Ave	Cleveland	OH	44113	40	1	Fast Food, American (Traditional), Restaurants, Burgers	-81.689174	41.500334
2019-06-12T12:24:03Z	KU6EYISdKH-jw3w7vZa6Pw	eGUl8DuamhgaM76Sy351BA	w39-HEkrn1jqHQsStTCURg	1	0	0	0	"How hard is it, not the work, to pay attention to your work. This McDonald's has to be by far the worst. From the Mgt. Down to the Fry person is so Fing LAZZZYY.
8 cars deep in a double drive threw and sat for 5 minuets and no one moved or had given their order. I pulled out and went in. I saw 1 girl taking back and refunding a WAY under cooked raw Berger.  Another girl leaning on the counter messing with her phone. And what looked to be a manager, well I can only describe how he was doing, a sloth moves lightning speed faster than this lazy person.
My meal, well hash brown under cooked,  OJ machine busted so I got a small bottle of OJ for 2 bucks. When I left the same 4 card still in line, the other 4 left.

Want a raise you fast food people say. BS, you don't deserve it."	McDonald's	15110 Saint Clair	Cleveland	OH	44110	7	1	Food, Fast Food, Burgers, Restaurants, Coffee & Tea	-81.575911	41.5527029982
2019-08-02T21:31:32Z	JIxA9BaEjidsv3TYOi-HOg	jul9sOvfoBLkr3TB5ZRC-w	OnqpDePGI152EreaSlC1UQ	4	0	0	0	This location is new very clean, plenty of employees, and lots of food options. If you happen to be downtown on game night they even have adult drink options! Did I mention the chicken sandwich is amazing!	Shake Shack	601 Euclid Ave	Cleveland	OH	44113	40	1	Fast Food, American (Traditional), Restaurants, Burgers	-81.689174	41.500334
2019-08-07T20:34:56Z	3dnF0DnQX0PqRb8wDyMJkA	uo-o0p3Hb3GqhgglUFOqig	1ZT4c6U1khRtiKKqZDSg4w	2	0	0	0	I have lived in Brunswick almost my whole life and I love it, but this McDonald's makes me crazy, they are always messing up order, taking forever to give you your food, almost every time you go through the drive through you have to move to a spot where they can bring out your food! I don't understand how they can be this slow	McDonald's	3115 Center Rd	Brunswick	OH	44212	15	1	Coffee & Tea, Burgers, Restaurants, Fast Food, Food	-81.8028514087	41.2397004162
2018-01-19T17:28:33Z	z7GWY9qP5l5JLt4rU5k-1w	-L6lBbhSp-d3mw8F9bBvng	9Md_dzgNNh8htwIxsBnmVw	1	0	0	1	"Extremely rude and slow customer service!  Special requests at the register will earn you a dirty look or an exasperated sigh, as if the cashier in front of you was actually not getting paid to do her job.  This also happened when I wanted to give a complaint to the manager; thought she was giving it her all not to tackle and strangle me.

Kitchen staff is uncomfortable to listen to and watch.  Have seen the guy at the fry station swearing at his coworkers and throwing equipment around when it was busy, which made other people around me upset, too.  Have also heard from the counter inside one of the workers taking orders call someone in the drive thru a set of horrendous names.

There's a 1/3 chance they'll get your order wrong here, and you'll have to wait a long time for your order for this being a fast-food service.  Staff and management needs to get their sh*t together.

Dining area is constantly filthy.  There are always splotches of food on the tables and wrapping papers and bits of food on the floor.  The entire building also needs to be updated.  It feels like I'm eating in a dilapidated building from 20 years ago.  

The same goes for the bathrooms.  Constantly dirty, out of toilet paper, or it reeks.

Hours are extremely inconvenient, again for this being a FAST-FOOD RESTAURANT.  10 a.m. to 10 p.m.  Not to mention workers will be visibly angry at you if you order something anywhere close to closing time.

DO NOT support this business.  If you want Wendy's, go to the Tarentum location down the street, it's a five-minute drive."	Wendy's	3164 Leechburg Rd.	Lower Burrell	PA	15068	3	1	Burgers, Hot Dogs, Restaurants, Fast Food	-79.711225	40.5854459
2018-12-21T23:55:48Z	C8jxaI_NmVpINEy0JquNZw	0_JkAdpuAtpn6KIYoYx_pg	FKrLUKHj-cOyRp2Vpmnw9g	1	0	0	0	We wanted something quick for supper. Since we live so close, my husband suggested McDonald's. Passed on the drive thru since there were a number of cars waiting and went inside. Had to wait a couple of minutes for someone to come to the counter. Placed my order (2 quarter pounders, a fish and Big Mac meal) and waited....and waited... and waited. Finally got the food, but they forgot the drink cup. Got the drink, but no straws or napkins. Perhaps it's quicker if you go through the drive thru. This place has really gone down hill.	McDonald's	1787 State Rd	Cuyahoga Falls	OH	44223	15	1	Fast Food, Burgers, Food, Restaurants, Coffee & Tea	-81.5077091753	41.1310837
2019-08-20T15:43:23Z	atu9bo2flyoM3CzihE-OlQ	vPPF3NhgbGxjiYoiaOxFpQ	mzQhuyHR3EdouyIYYJEluQ	1	0	0	0	"Rebecca, the "manager," needs to be taught what customer service is all about.
I'm sorry if I sat at the BLANK screen for about 10 minutes, waiting to hear from an employee. In the meantime, I watched the car in front of me pull around without seeing them having their order taken, due to the time of my arrival. And, keep in mind, that this store has difficulties with their screen quite often.
When I get to the first window, I am met with the employee and the manager, who tells me that I must order from the screen, and that sometimes the screen is just black, and that she cannot take my order. No apology, nothing! Oh, I'm sorry that I watched a black screen, and still my presence wasn't even acknowledged, such as, "Be right with you." Common sense/customer service shouldn't have to be taught to a manager. I really hope that your other managers are not as ignorant."	Wendy's	1660 Cochran Rd.	Pittsburgh	PA	15220	22	1	Fast Food, Restaurants, Burgers	-80.062159	40.392738
2019-08-24T22:11:31Z	6qAChWfCZVDvXNtcyhze-g	Xf7yvQ9yRh96ID-g2YduCw	5rSp3YtzKdF7yazOZYW9pA	1	0	0	0	Terrible service, and the workers don't seem to have good personal hygienes. I don't feel comfortable eating food from a restaurant when the employees don't look clean. I don't do McDonald's anymore.	McDonald's	101 Hoffman Blvd	Duquesne	PA	15110	16	1	Food, Fast Food, Coffee & Tea, Burgers, Restaurants	-79.8632582277	40.3842109294
2019-10-29T00:54:04Z	JIxA9BaEjidsv3TYOi-HOg	VzBqUe8o_Elto-_7e7Oo8Q	SBnk6UQPu9NIXanW9O5UeA	4	0	0	0	Greeted by a nice gentleman at the counter ordered an ice cold beer it was pretty good! Got myself a cheeseburger and my Mom ordered the chicken bites and a shake. Pretty good food! I love the interior design here it's all great woodwork in a minimalist sort of modern layout. Very cool	Shake Shack	601 Euclid Ave	Cleveland	OH	44113	40	1	Fast Food, American (Traditional), Restaurants, Burgers	-81.689174	41.500334
2019-06-21T13:02:28Z	JIxA9BaEjidsv3TYOi-HOg	-ElY4-9sEWvX7doMU46o0Q	_a7O6G9QY9dHxESCrTu97w	4	2	5	4	"Downtown isn't lacking options for food. However, along the Euclid and E9 stretch, shake shack adds a nice update. Next to potbelly and across from the arcade, this location was right on time for burgers and fries. 

I went on the first day, so of course the service was Supreme. Everyone was smiling and happy. There was even a helpful manager going through the line asking if anyone has questions about the menu or needed help at all. I'll also say that there were ample employees preparing the food. Not sure if that will be the normal Staffing, but it sure was nice to see that they anticipated just what the lunch time rush in downtown could look like.

My burger was quality. Toasted bun, fresh toppings, cooked just right. My only gripe was the sauce. It's a mayo blend that just didn't work for me. I'd suggest getting it on the side if you're a first timer. Fries were crispy and yummy!

Even with the crowd, I got great service and a solid burger. Welcome downtown, Shake Shack!"	Shake Shack	601 Euclid Ave	Cleveland	OH	44113	40	1	Fast Food, American (Traditional), Restaurants, Burgers	-81.689174	41.500334
2019-10-30T21:37:39Z	3dnF0DnQX0PqRb8wDyMJkA	7mt7lZT3hgUAnP5tyFsyCA	ZJfqEBtvnGw6cx4AO1xZyA	2	0	0	0	"Ordered online and service was quick and polite.
Maybe too quick...? See picture of my raw 1/4 pounder I was sold."	McDonald's	3115 Center Rd	Brunswick	OH	44212	15	1	Coffee & Tea, Burgers, Restaurants, Fast Food, Food	-81.8028514087	41.2397004162
2014-08-17T18:53:08Z	6qAChWfCZVDvXNtcyhze-g	qzbo8u-SxaFwc6MIxIZkcw	2Sa4Zhw-0zGF3aeTDWDmRA	1	0	0	1	"By far the absolute worst Mcdonalds in the
World. You can pretty much rest assured that, after your long wait in the drive thru, your order will most definitely be wrong.  Calls to the owner go ignored. Rice Enterprises own a majority of the McDonalds in the South Hills.  They have all gone down hill in quality, service and cleanliness.  The owner has to be the problem."	McDonald's	101 Hoffman Blvd	Duquesne	PA	15110	16	1	Food, Fast Food, Coffee & Tea, Burgers, Restaurants	-79.8632582277	40.3842109294
2019-12-10T00:50:26Z	z7GWY9qP5l5JLt4rU5k-1w	PIY6h989GySZ3YRYAqNoZA	7avRAc7HBQkjH-GBFOzG4A	1	0	0	0	Lately everytime me and my family come here our food is cold, they got the order wrong and the staff is to busy talking instead of doing there job and then they have the audacity to be rude. Y'all need new management. This is ridiculous.	Wendy's	3164 Leechburg Rd.	Lower Burrell	PA	15068	3	1	Burgers, Hot Dogs, Restaurants, Fast Food	-79.711225	40.5854459
2019-03-16T03:08:12Z	6qAChWfCZVDvXNtcyhze-g	tnpChff-6iKuX_rxZtYqIw	Up5Bq3h73toeieP2oRlfDA	1	0	0	0	I visited here this past Saturday (3/9) and I was in the drive thru for about 25 minutes and there was only one car in front of me. I pull up to the window and there were about 2-3 employees that were up front and it looked like one of their friends came in and they proceeded to ignore me and i had been sitting there for 5 minutes waiting to pay for my food. I get that it's McDonald's and it's a bad job but you have people waiting on you and we just wanna get in and out. So if you're looking to get fast food and just wanna get in and out don't go here.	McDonald's	101 Hoffman Blvd	Duquesne	PA	15110	16	1	Food, Fast Food, Coffee & Tea, Burgers, Restaurants	-79.8632582277	40.3842109294
2019-07-21T21:56:58Z	KU6EYISdKH-jw3w7vZa6Pw	gQU7kwswKQUyd27pZGIVfg	tfmYRePvyzJSW7wdxfFo0Q	1	0	0	0	I've been in the area for a couple months, as time went on and the more I visited the quality has been declining. It went from cold fries every visit to my order being messed up most of the time. Workers have had my order just sitting there not given to me for 30+ minutes. I'm giving the location 1 star out of 5 because even though some of the workers are very cruel and they move extremely slow, they keep their restaurant very clean.	McDonald's	15110 Saint Clair	Cleveland	OH	44110	7	1	Food, Fast Food, Burgers, Restaurants, Coffee & Tea	-81.575911	41.5527029982
2019-11-21T14:42:26Z	JIxA9BaEjidsv3TYOi-HOg	nH91dkrSJ9EH66FzMhUAKQ	Vk9Er1OJqny-6frkaJOwpQ	4	1	1	1	Liked the food ! Came fast and hot a little to salty for me though! Still would go back	Shake Shack	601 Euclid Ave	Cleveland	OH	44113	40	1	Fast Food, American (Traditional), Restaurants, Burgers	-81.689174	41.500334
2018-07-03T18:26:38Z	6qAChWfCZVDvXNtcyhze-g	tsFqJfdS7guYPHL3YAdfaA	Q0RlLft2ZoAuSHK9lmyeAw	1	1	0	1	If you're interested in watching the speed of sloths working then by all means come here. Sitting in drive thru while workers took their time to SLOWLY gather orders while on their phone is a bit ridiculous.	McDonald's	101 Hoffman Blvd	Duquesne	PA	15110	16	1	Food, Fast Food, Coffee & Tea, Burgers, Restaurants	-79.8632582277	40.3842109294
2019-08-04T20:30:41Z	6qAChWfCZVDvXNtcyhze-g	LbbCIERNdjH2UJmCE9q4Gw	jVTWzl9gC6MkyztUw11Yjg	1	0	0	0	"Worst McDonalds on the face of the planet. Service is slow and inaccurate. I think I waited 10-15 mins just for a McDouble. Drive through is nothing better. Avoid at all
cost."	McDonald's	101 Hoffman Blvd	Duquesne	PA	15110	16	1	Food, Fast Food, Coffee & Tea, Burgers, Restaurants	-79.8632582277	40.3842109294
2018-04-08T15:37:57Z	nJYCyUpjms2E7SHgKwte9A	yrmI1xxvi2UNciep5c0REg	zrLgS7mg5etdm3KCECjJ5Q	1	1	0	1	So I ordered the McRib meal and The lady says alright it's 3.50 and then I asked her well aren't you going to offer the extra McRib for a dollar she then looked me up and down and said well it doesn't look like you need the extra McRib. I couldn't believe it I throat punched that bitch. WHAT A MCBITCH	McDonald's	3820 Wm Penn Hwy	Murrysville	PA	15668	7	1	Restaurants, Burgers, Food, Coffee & Tea, Fast Food	-79.6990802139	40.42743994
2019-07-10T00:16:37Z	JIxA9BaEjidsv3TYOi-HOg	hhzG1fdImdfYOtg3LCxGeQ	-K5-6hDN7gcNMJo_ChNtCg	4	0	1	2	"Perfect location for shake shack, right down the street from where I live it. Down the block from tower city and across from e 4th street. 

I've tried shake shack from different locations and the only thing difference I notice that they tried to rush some of the food coming out. But we also went during rush hour and all star week, so every restaurant was a little pressured. 

Would gladly come back here again to give it another try."	Shake Shack	601 Euclid Ave	Cleveland	OH	44113	40	1	Fast Food, American (Traditional), Restaurants, Burgers	-81.689174	41.500334
2018-06-17T05:18:11Z	6qAChWfCZVDvXNtcyhze-g	4XKawdd6Sb5zvvkbBo0IlA	Wwo3xHJWoCLSONm1nk9y8w	1	1	1	4	I do not usually rate fast food places. This is definitely an exception. Supposedly understaffed with 8 workers... Refused to open handicapped entrance due to this for a woman with a full leg cast and crutches, who was clearly disabled. Lady waited for 30 minutes before struggling around to the other entrance.  Besides this, the visible part of the kitchen was horribly dirty. Piles of trash bags blocking back door. Flies EVERYWHERE behind counter.  This was definitely not a very busy time. I really hope management sees this and takes note.	McDonald's	101 Hoffman Blvd	Duquesne	PA	15110	16	1	Food, Fast Food, Coffee & Tea, Burgers, Restaurants	-79.8632582277	40.3842109294
2018-09-19T23:59:08Z	C8jxaI_NmVpINEy0JquNZw	Jd-L0O8ui1VCiJT3Xw5YBw	FKrLUKHj-cOyRp2Vpmnw9g	1	0	0	0	Hope springs eternal! They just can't get it right though. We live less then 5 minuets away, husband went to pick up breakfast, I had ordered an oatmeal. When I opened it i found that it was not cooked, I had to finish it in the microwave. Tonight I ordered a crispy buttermilk chicken sandwich. The box says it's a crispy buttermilk chicken sandwich however it's really a grilled chicken sandwich. I've gotta stop going there!!!	McDonald's	1787 State Rd	Cuyahoga Falls	OH	44223	15	1	Fast Food, Burgers, Food, Restaurants, Coffee & Tea	-81.5077091753	41.1310837
2019-11-03T16:33:27Z	FUTAQs8NEgpiQUXISaXfLg	GdgWIujmMsKSzJCu_fPuCQ	zrZLTBeSmDISOOyEcZ_h3g	2	0	0	0	The Whopper Sandwich is still the standout, flagship product here and the best choice although the plain old regular hamburgers and cheeseburgers are good choices as well. But what is up with the fake onion rings? There is some sort of processed onion pulp inside instead of simply battered onion slices? Another thing is their hash browns suck. They use some little tiny Ore-Ida tater tot disk instead of the large meaty patty like McDonalds and the cooking time for these is very unforgiving and easy to over cook and burn. They always seem burnt no matter what Burger King I go to around the country. Taco Johns manages to do the same tater tot disks properly. Furthermore, the oil they use to fry the hash browns in tastes very strongly of the long chicken sandwich they have on the menu and I don't really want that chicken sandwich flavor with my breakfast food.	Burger King	1325 N Dunlap Ave	Savoy	IL	61874	15	1	Restaurants, Fast Food, Burgers, Food	-88.2489681244	40.0706497611
2019-06-20T22:27:43Z	JIxA9BaEjidsv3TYOi-HOg	Cv-GUbC0rf7YlsAmdRFzmw	hrel0o71Ilo2bIzc0o6xSg	4	1	1	3	I love the shakes! Makes everything taste better! I originally went to Thr Shake Shack in NY a couple of years ago and remembered the chocolate milkshake! I had to try it in Cleveland, still good!	Shake Shack	601 Euclid Ave	Cleveland	OH	44113	40	1	Fast Food, American (Traditional), Restaurants, Burgers	-81.689174	41.500334
