date	business_id	review_id	user_id	stars	funny	cool	useful	text	name	address	city	state	postal_code	review_count	is_open	categories	longitude	latitude
2010-12-19T22:02:39Z	ax8kuBZVtC0_eCn_rN_-6A	K7NtOfz4hAtF9svJ8Wxtgw	rCWrxuRC8_pfagpchtHp6A	2	13	8	8	"The East Carson Street Pizza Gauntlet Part 4.5: An Interlude

Kay and I had full bladders and couldn't stand Pi enough to want to relieve ourselves there. The 5th pizza place we wanted to try had become a full-on bar. I had seen another pizza parlor that I hadn't heard or read of before, so we made our way back up Carson to where we parked, in search of a bathroom and one more pizza place afterwards before ending our intensely chilled evening out on the tiles. 

When we went back to the bathrooms, we found that both were locked.

Oh, you KNOW how this works: A few heroin junkies spoil it for the straight-edgers like me. Damn it. 

We had to buy something before we'd be allowed to use the facilities. 

I went through this before at a McDonald's last year on St. Paddy's Day. Hey, I was pressured into downing a yard of green beer. 

Well, I orderd a Hi-C, and Kay had a Diet Coke. This was after waiting 20 minutes. 

The gruff manager said "I'll unlock the doors," with a smirk on his face. He had us. I smirked back since I knew what the racket was. 

I urinated for what was seemingly an eternity, got back to our seat, and sipped on the Hi-C...with a pizza box in front of us. The gaggle of high-school kids across from us thought that was funny.

"Do they eat Subway sandwiches at Wendys? Huh-huh-huh."

I felt like going over to explain our night to them but decided that it would be futile. What teenager even knows what Yelp is? 

Alas BK, your burgers are dry, your onion rings bland, and you add/remove too many items from your menu. As Ronnie Dio used to sing...

http://www.youtube.com/watch?v=Z3ZfrCPKEqM&feature=related

While we were here, we found someone to give our crappy Pi Coal Fired Pizza to.

P.S. My grandmother used to come to this BK when she was alive and living in South Side 2.5 decades ago. She would only come by to pilfer straws, sugar, plastic utensils, napkins, and coffee creamer. God Bless her. She may have been the subject of a certain Jane's Addiction song."	Burger King	1820 East Carson Street	Pittsburgh	PA	15203	45	1	Fast Food, Restaurants, Burgers	-79.9795539	40.4284472
2012-04-14T00:13:25Z	ax8kuBZVtC0_eCn_rN_-6A	whLGWIYaEFzou_8Zx-Bp2g	ACwBMSJzgW6vOvV7vOrk8Q	2	11	2	3	"There's something scary about going through a drive-thru that's dark.  Come around the bend from ordering at the sign and you may think you are about to be the first victim in a new horror flick.  The bushes are overgrown, weeds popping up around them.  Then you pull around and see you have to go through a dark tunnel.

A dim light flickers overhead, you hear the hum of your car engine and smell the exhaust.  You pull up to the rickety window and as it opens you almost expect an axe wielding murderer to be on the other side.  You silently pay for your food in fear that you may say the wrong thing to bring on the wrath of the employee.

As you quietly pull away, you think you're almost free until you hear the *ding ding* of the bell that reminds you of pulling up to the gas pumps.  As you pull back into the light of daylight you think to yourself, 'I survived!'

Well almost, that is until you discover now you have to dodge pedestrians on the sidewalk and then pray to god that you can get back onto Carson St.  Good luck with that.

I wouldn't step foot in this place.  Yes, it looks all nostalgic from the outside, but once you get inside it just looks rundown.

As far as Burger King goes, take the time to go elsewhere."	Burger King	1820 East Carson Street	Pittsburgh	PA	15203	45	1	Fast Food, Restaurants, Burgers	-79.9795539	40.4284472
2014-12-24T18:56:49Z	ax8kuBZVtC0_eCn_rN_-6A	OMjr6xiyj3n3Nu1Ovp1HHg	d0D7L-vfQDIADolnPAcb9A	2	2	2	2	"I thought after the remodel it would've better because it honestly couldn't have gotten worse... it's the same though. 

Same cold fries, overdone chicken sandwiches, same annoying kids still loitering and hanging inside without buying food. 

On a positive note, the workers are nice and they have that futurerama Coke machine ;)

Please do something about the loitering. Alot of business is getting lost because you let 14-17 year olds chill, talk loud and reckles... cursing up a storm. No employee says anything.. Yet they didn't spend $1 to contribute to your sales :/"	Burger King	1820 East Carson Street	Pittsburgh	PA	15203	45	1	Fast Food, Restaurants, Burgers	-79.9795539	40.4284472
2018-05-24T05:06:19Z	U_Hxyrx7yGDliv_TPa6i_A	sK4GP1FK82kSnFAjIvJOpw	gc-SGtg38v4S1JoY6I3n-A	2	0	0	0	The online ordering only works some times (Which is the only way to use the really good coupons now). I've waited 20 minutes in the drive through for 2 happy meals and a couple items off the dollar menu... no huge order. The positive is that I'm almost always greeted by someone happy...or at least not grumpy (I've visited probably 5-10 times). It's either here or Arby's for fast food, so...	McDonald's	1006 Purnell Dr	Mahomet	IL	61853	14	1	Coffee & Tea, Fast Food, Restaurants, Food, Burgers	-88.3682081	40.1854262
2014-07-16T20:14:11Z	NHersw9tR7dnmlZINOBi9Q	oyihw5pgQIZG8lNbcIrEJg	BKRnVgocUSlBJTbR9Elulg	1	1	0	3	Order #488 today at 4pm. Nobody else in line. 10 seconds to get my drink but six minute ticket time. Manager came forward, grabbed the receipt out my hand, crumpled it up and handed me my food. Do I need to repeat that? Corporate will be called.	McDonald's	230 W Huron Rd	Cleveland	OH	44113	5	0	Burgers, Fast Food, Restaurants	-81.6936185	41.4969048
2018-06-29T22:01:44Z	ax8kuBZVtC0_eCn_rN_-6A	J6sBJ41rKom402la7Xc79A	vD2HML4pseH8-0HH3CrWzA	2	1	1	0	Went through the drive thru today for a 10 piece nuggets, large fries & 2 cheeseburgers.  I waited 10 minutes for them to serve the car in front of me and over 10 minutes at the window waiting for my order...! I could see in the window and they weren't busy...  The bag with nuggets & fries was sitting there the whole time but the burgers weren't done.  I heard the guy ask for them 3 times...!  How can they call this fast food?  Got home (5 mins away) and the burgers were still warm but the fries & nuggets were cold.  Im only giving them 2 stars because the guy working the window was very polite.	Burger King	1820 East Carson Street	Pittsburgh	PA	15203	45	1	Fast Food, Restaurants, Burgers	-79.9795539	40.4284472
2017-06-11T20:53:50Z	ESIGmCLS5RgOLCWN7e8TFQ	dpyTH5HW4jWWGeqzNDU2KA	F6G1LZ_oZzfLHGSOtgpb4A	1	1	0	0	"This McDonalds is the absolute worst! Waited 15 mins before giving my order. I specifically said I wanted CRISPY snack wrap and I had to repeat my order back to her twice. And literally 25 mins later when I actually get my food my fries were soggy and not even salted....and despite the fact I emphasized how I wanted the crispy snack wrap they gave me grilled 
I recommend driving to the next Mcdonalds to grab a quick bite -this place is awful"	McDonald's	1349 E Tallmadge Ave	Akron	OH	44310	8	1	Restaurants, Burgers, Fast Food, Coffee & Tea, Food	-81.4659614	41.102459
2016-01-01T21:46:38Z	x9ABq0u2quurwRYlVDydVg	88TUuRtLLV-M-FuE2P-bYw	dhQOA8-FdpA6D0hNhXEYIw	3	0	0	0	"I love their burgers. As far as fast food burger joints go, they're one of the absolute best in the Pittsburgh region. They're very consistent from restaurant to restaurant as well.

Their toppings are free and always fresh in my experience. I typically go with lettuce, tomato, pickle, grilled onion, and ketchup/mustard. Fries are also great and I love that they typically have vinegar available.

My biggest gripe? Price. I always order the "little" cheeseburger and "little" fry which basically means one party in the burger and the smallest fry available. Yet, when I do it costs $12.50 for a meal with a drink. I can basically eat at BRGR or Burgatory for this price. Ideally they would come up with a combo meal so that fries/drink do t add $5-6 to your order."	Five Guys	1000 Ross Park Mall Dr	Pittsburgh	PA	15237	7	1	American (New), Fast Food, Restaurants, Burgers	-80.0087509	40.5445585
2014-09-21T05:42:45Z	s8sAe29mA8q1eQwdC1qAKw	NkFm1TyYD4c8nde-QjzgpQ	GoeHBmVr2bb395Zb74vU_w	2	2	0	3	"When this Wendy's opened, it was extremely well-run.  The staff was on point, and the managers did a great job of moving things along.  

That lasted for about a week.  Since then, it's become an embodiment of everything bad about fast food.  The employees are really dredged from the bottom of the barrel here.  On more than one occasion, I've had someone completely stop taking my order to talk at length with some friends who had just walked in.  Orders-- even incredibly simple orders-- are routinely botched.  The restaurant has flies.

I'm glad that there's a Wendy's on State Street.  I just wish that it wasn't such a crappy Wendy's."	Wendy's	534 State St	Madison	WI	53703	10	0	Burgers, Fast Food, Restaurants	-89.394324	43.0751289
2013-01-18T22:34:28Z	UobSPAAzgt7HKmWoepi31A	IPjvCUt0qOiUd4HHd7_HZQ	MW5wG7jEbuc_Kn1BIXd4dw	2	0	0	1	"This is a very slow and disorganized restaurant. The wait times are often long and I regularly have to pull over because they don't have food ready. Be sure to carefully go through your order once you receive it, I've received wrong or incomplete orders many times. We also noticed very salty hamburger patties a couple times.

Unless you're desperate for some McDonalds go elsewhere. On the other hand; if you're trying to kick your Micky Dee's habit the experience you'll routinely receive at this restaurant may help you do it.

The only reason I'm not giving them a one star review is because I know I will probably eat there again - it's the only McDonalds option near my home."	McDonald's	30100 Detroit Rd	Westlake	OH	44145	20	1	Fast Food, Restaurants, Food, Burgers, Coffee & Tea	-81.9539268315	41.4637571887
2016-11-29T12:35:05Z	ax8kuBZVtC0_eCn_rN_-6A	tzzgDvpJFv1URsExu0s9gA	NHwqfU8b_8cf1H05FDt9Eg	2	1	0	0	"Ordered a kids meal and a burger and fries for my child and me. Both burgers were made wrong. Fries were cold. It took them about ten minutes to remake the burgers which was odd considering the first time it took five minutes.

When we returned the burgers, the staff started bickering and arguing about who did what and why they were wrong. None of the bickering was directed towards me. But no one needs to hear that. Just fix the burgers. 

All the staff were very friendly though. Food, once made, was greasy and tasty like it should be."	Burger King	1820 East Carson Street	Pittsburgh	PA	15203	45	1	Fast Food, Restaurants, Burgers	-79.9795539	40.4284472
2014-02-21T15:54:47Z	NHersw9tR7dnmlZINOBi9Q	PllgPpc8BNbBvGKJBO0HvQ	7tpP9L0FYg0AGOUr2fZ3Rw	1	2	0	2	"Horrible Service, staff is not bothered, they are just lazy and dont care.  I would say avoid this place. else you gonna spoil your day. Today I went to get coffee and the place looked chaotic with so many customers. I wasnt sure if all of those customers were waiting to order to pick their orders. One of the staff member was at cash register lazily looking at customers and not doing anything. When I was about to ask her if I can order, she said she is ready for next order. I order a latte and it was horrible, cold, and too much sugary syrup. 

I would rate 0 but thats not possible.

Just Avoid It"	McDonald's	230 W Huron Rd	Cleveland	OH	44113	5	0	Burgers, Fast Food, Restaurants	-81.6936185	41.4969048
2018-01-18T15:55:19Z	Xoahafjr-Hz9zLrodYvDBA	XEpXZ8wav4X3sPwfUwgnTw	E_tboAdgMz4qcK5id46Qew	2	0	0	0	"I've had breakfast at a lot of Burger King stores and this one in rantoul has the worst biscuits of them all. I don't if they're just shit biscuits or if it's because the dipshit millennials who just don't give a shit.
Maybe they're too busy holding their phone to their faces to pay attention to their job."	Burger King	720 West Champaign Ave	Rantoul	IL	61866	19	1	Burgers, Restaurants, Fast Food, Hot Dogs	-88.1734807	40.3086346
2016-07-08T18:36:19Z	uxm2CPgLbs98s9OGPu5gXg	GAL5vvr0RUrPy6MVyE3zTQ	Zm3dHpHqZ-R4wCnopb_lQA	4	0	0	0	"Best burgers ever --- Fries are so so (greasy/soggy) and too much.

Convenient, clean and fast."	Five Guys	17695 Bagley Rd	Middleburg Heights	OH	44130	24	1	American (New), Burgers, Restaurants, Fast Food	-81.8239072	41.3714793
2018-05-16T23:00:58Z	d0GmiP5cai20VZr0a_bNnQ	r-tn7HwCyKGuE3gOhwSv8w	W8EAuJDTuy9foHWGvoyGxg	2	0	0	0	Usually we visit McDonald's for their milkshakes. Today we came to pick a quick lunch. My son loves their hot cakes and typically I will only get a drink for myself. Kind of crazy but cheaper to buy the hotcakes with sausage compared to just the hotcakes. I like their pineapple mango smoothie. We tried their new blue raspberry icee and it was good. Their employees could be a bit more pleasant though.	McDonald's	2090 Lebanon Church Rd	West Mifflin	PA	15122	11	1	Coffee & Tea, Restaurants, Burgers, Fast Food, Food	-79.9453047	40.3479004018
2017-01-09T17:00:46Z	ax8kuBZVtC0_eCn_rN_-6A	IxKGAhb1MZBOFWtET3FH4w	fSfGK7l0Rb89cDWtaB0x3Q	2	0	0	0	"Mary M
1/9/17
I was here in October of 2016. I had there whopper, french fries and a raspberry sprite. They put too much sauce on the whopper. It was mushy. The fries were not too good. the only thing I enjoyed was the sprite. I will never return."	Burger King	1820 East Carson Street	Pittsburgh	PA	15203	45	1	Fast Food, Restaurants, Burgers	-79.9795539	40.4284472
2016-01-01T11:12:30Z	NHersw9tR7dnmlZINOBi9Q	4UKd9xG8tMb5zfF2CrThAQ	gYq1O8jtmDSk1sGKcvd22Q	1	0	0	0	Yeah this used to be a good McDonald but for some reason they change a couple times within the last week I've been downtown I decided I want to a fish sandwich so I went over to McDonalds in my wheelchair and fatter nobody in line the workers were back to just gabbing away and looking at me like I wasn't there I waited so I waited and I just left so the next day nobody was in line ever busy with some guy dancing Oh weird person hey bro wats and I'm laughing I waited another person left in front of me got tired of waiting I guess I just know the its slow	McDonald's	230 W Huron Rd	Cleveland	OH	44113	5	0	Burgers, Fast Food, Restaurants	-81.6936185	41.4969048
2016-09-17T20:35:36Z	ax8kuBZVtC0_eCn_rN_-6A	KWdebCerqCGWCfvX8yktbw	dxXCiAa3pbaapc7DPd_7LA	2	0	0	0	Service was fast and professional, the floors were kind of sticky in some places. I was ordering food and saw the manager push the food in the trash down and without washing his hands, proceed to serve food. The tables & chairs were dirty, I asked an employee if they could wipe off a table so my father & I could eat, they of course said yes but didn't do so until 30 min later. We sat down and wiped the table ourselves and an employee saw us and ran over and apologized. The place has good staff but the standards were really low.	Burger King	1820 East Carson Street	Pittsburgh	PA	15203	45	1	Fast Food, Restaurants, Burgers	-79.9795539	40.4284472
2015-11-03T18:47:57Z	jux9zFaGcIRjrMIBaVJsHQ	Licr6eqdmeq1D3NTG3k7Ig	tbycp0aRhRsiAVYUAVR_uQ	3	0	1	1	There is nothing outstanding about the food at this location. They are Burger King. Isn't that the point of fast food?  Continuity. What I really like? They are right off the belt line so they are fast. This is outstanding. Even when the line is out of the parking lot, they get you through quickly.	Burger King	719 W Badger Rd	Madison	WI	53713	10	1	Burgers, Food, Restaurants, Fast Food	-89.393016	43.038112
2013-02-14T00:24:07Z	ax8kuBZVtC0_eCn_rN_-6A	Xy2NBgwp0Ig8BTvBLLI_-g	B7aR8VlLMGzaJ7NHC-jeMQ	2	14	3	5	"If you've ever said to yourself "Hey I want to eat lunch in a dirty bus station in the south this place is for you!"

Consistently the dirtiest restaurant in the city and I my visits are years apart.  The food is typical burger king fare but definately get a to go bag."	Burger King	1820 East Carson Street	Pittsburgh	PA	15203	45	1	Fast Food, Restaurants, Burgers	-79.9795539	40.4284472
2007-04-29T06:28:51Z	UobSPAAzgt7HKmWoepi31A	1HxBAn0du_gEo6UMGVcgSA	qWTeFVdxXS-H5l41XA_Lxw	2	2	1	4	"Taking the "fast" out of fast food...

THE UP-SIDE:  Once in a while, we all eat at McDonalds.  This one happens to be very clean and nearly "nice" on the inside.  However...

THE DOWN-SIDE:  I've gone to this location several times over the past two years.  Each time, I went through the drive-through and had to endure a wait of over 10 minutes.  I literally waited 15 minutes in line on two different ocassions.  

So, just today when I visited, I thought, "Hmm.  I'll be smart this time.  I'll go inside to beat the line drive-through line wrapping around the building."  Well, I should have known better.  Inside, the line snaked to the door; just two feet from where I entered the restaurant.  They had one woman on the register and she was moving at a snail's pace.

I waited for a full 10 minutes - yes, I'm an idiot - and still hadn't even gotten to place my order.  In fact, there were still five people in front of me!  Frustrated and hating myself for giving this place yet another shot, I left without food and vowed NEVER TO RETURN.

THE SUM-IT-UP: I really don't like McDonalds that much, but I do think that they seem pretty well-run overall.  However, this particular location is an anomoly.  It's just downright horrid in it's customer service and nobody - I mean nobody - should ever stop here for "fast" food.  

This place is terrible."	McDonald's	30100 Detroit Rd	Westlake	OH	44145	20	1	Fast Food, Restaurants, Food, Burgers, Coffee & Tea	-81.9539268315	41.4637571887
2016-07-21T19:20:42Z	uxm2CPgLbs98s9OGPu5gXg	RegCB7b-RZDZPY4EeAeH3g	TFc-_s4KTbh53U5pAOVm5w	4	0	0	0	"I ate too much.  

I feel so gross right now because I ate so much good food.  It was great, I just ate and ate when I should have stopped and surrendered.  

Great place."	Five Guys	17695 Bagley Rd	Middleburg Heights	OH	44130	24	1	American (New), Burgers, Restaurants, Fast Food	-81.8239072	41.3714793
2012-08-11T03:24:31Z	ESIGmCLS5RgOLCWN7e8TFQ	wyJm-1onWxJM9fNBAO-_NA	t6gkLwh7gK5LvPQ66U0VcQ	1	0	0	0	Place sucks terrible service bunch of teens working there.	McDonald's	1349 E Tallmadge Ave	Akron	OH	44310	8	1	Restaurants, Burgers, Fast Food, Coffee & Tea, Food	-81.4659614	41.102459
2015-02-01T04:27:24Z	Xoahafjr-Hz9zLrodYvDBA	6Did12aQsdvPtJrO9pZU4Q	1xJwMqmvVXPwY7yEVQIc-A	2	3	0	3	"This review was originally started on the road about summer of 2014.  When you're on the road (long distance driving), eating options are few and far between them.  I kept hoping to find a Trader Joes or Whole Foods market but, no effing chance.

-------------------------------
Probably the worst "fast food" visit yet.  Not worst in the sense that I have a juicy story to share but that it took ever so long to get a small order fulfilled in comparison to their competitors next door.  Ya know, the motorist traveling the interstate is probably their most typical sort of consumer and their everyday challenge is to win some of that motorist business.  
I would think that Burger King would staff only their best to support these needs of the weary traveler, yes? Maybe?  Absolutely not.  
Their customer service is pretty good and their employees are able to converse appropriately but their turn around times in serving just plain STINK!.  In the not-so-recent past, upon visits to Chicago BK's I would remember staff asking drive-up customers to reverse or move forward so that they could fake out BK corporate about how quickly they could meet customer demand. (Faking out their drive-up window timers)  These kinds of requests were not made here.  Instead we waited and waited and waited, for typical, every-order, type BK items.  The wait was so long that we started taking note of how quickly their neighbor Arby's, were able to respond to their drive-up business in far more suitable times.

Originally we thought about hitting Arby's but they had a sizable line and for some reason we thought between the two fast food evils, this would be the better. 
Wonk, wonk, wonk.."	Burger King	720 West Champaign Ave	Rantoul	IL	61866	19	1	Burgers, Restaurants, Fast Food, Hot Dogs	-88.1734807	40.3086346
2014-01-14T12:38:03Z	NHersw9tR7dnmlZINOBi9Q	rYYVZD34dIdInG7EVXIhKw	iRa-q8aNk9-FLzsO-YrHhA	1	3	0	4	This McDonalds is always horrible.  I think that the only reason they are still open is because they are located in Tower City.  The staff is rude, the management is horrible.  Turn around time is the worst.  I waited 10 minutes for a coffee and a hash?  This is not fast food.  And if you say anything, they treat you even worst.	McDonald's	230 W Huron Rd	Cleveland	OH	44113	5	0	Burgers, Fast Food, Restaurants	-81.6936185	41.4969048
2014-09-04T01:53:43Z	dFZ8hE_RZJeCuWnfY1oo4w	wwDn6xTKF2iwzt_npj9uCw	IgUumWLRfvoVeZ7qE-MU9w	2	0	1	1	"Went here the other night and ordered a dinner box. What a joke. The fries weren't done, they were really limp and soggy. They forgot the nugget sauce. The Big Macs looked liked they were thrown around the kitchen before they boxed them up. And Mickey D's wonders why they are losing business. 

Between poor service and crappy food, what do they expect? At least the manager made it right today and gave me a new dinner box no charge. I would have given more stars for that, but she seemed to have had an attitude about it."	McDonald's	23 Southeast Ave	Tallmadge	OH	44278	10	1	Burgers, Fast Food, Hot Dogs, Coffee & Tea, Restaurants, Food	-81.4391004	41.100594
2018-07-16T19:01:47Z	FuxoVLzUrVwJWImV3nghVg	XNL7h_GMrLNFSGxPFyNQwA	sTQU48ylBs3dPXRPrew5hg	1	0	0	0	This may be the worst freaking McDonald's in Cleveland!!!!!! They have more flies in that building than they do employees!! All the girls in there have terrible attitudes. I usually order there from uber eats Bc I work at Cleveland clinic. Literally every time I order, SOMETHING comes to me WRONG!!! Either my fries are soggy and cold (mind you, it's like a 3 minutes walk from here to there! So the fact the food is in a car is ridiculous)..I'll order coke they'll send me Sprite! I'll order a sauce for my nuggets and get no sauce OR nuggets! I just ordered a bacon ranch salad for my lunch and I get the salad..the lid is off in the bag and they gave me a damn SOUTHWEST!!! Like seriously I don't understand what the hell is so hard about reading a paper and making the order CORRECT!!! They need to just tear this building down and hire a whole new crew Bc the current one is obviously stuck on stupid! This will be the last time I order from there! And when i get my replacement i WILL make sure I get the corporate number TODAY!! Btw they're only getting one star Bc I can't leave zero!	McDonald's	8210 Euclid Ave	Cleveland	OH	44103	13	1	Fast Food, Burgers, Restaurants, Food, Coffee & Tea	-81.6300559498	41.5030905708
2012-08-11T14:01:47Z	ESIGmCLS5RgOLCWN7e8TFQ	uMl61oFECEvTmuJDu37FWg	BYHm-dCBHRtiUDgOfFgLhw	1	1	0	0	"Somehow I fell back assward into 1977 at this Micky D's same air, food and coffee...I remember why I don't eat McD's....
Guuuh...."	McDonald's	1349 E Tallmadge Ave	Akron	OH	44310	8	1	Restaurants, Burgers, Fast Food, Coffee & Tea, Food	-81.4659614	41.102459
2015-03-14T00:14:03Z	wCoAzScVWpL9bsDsyf1EIQ	-ACZGugNPqgF41dFNC1YlQ	HvlewOxcLC9JaZKDCCMNSA	2	0	0	0	I ordered a meal,  and got large fries. When I opened the bag my fries were half full. I know,  not a big deal but that's just cheating customer. I want what I paid for not half of it.	McDonald's	601 N Cunningham	Urbana	IL	61801	10	1	Restaurants, Fast Food, Food, Burgers, Coffee & Tea	-88.2044307038	40.1182515363
2016-10-22T20:14:56Z	uxm2CPgLbs98s9OGPu5gXg	nRZBPcqqZ7Fl28ihboeGIA	TERKMULbOh1Ee6dImTIpCg	4	0	0	0	Great tasting burgers but the fries were soggy both times I tried them. Several people I know mentioned that this location makes better burgers than other five guys locations.	Five Guys	17695 Bagley Rd	Middleburg Heights	OH	44130	24	1	American (New), Burgers, Restaurants, Fast Food	-81.8239072	41.3714793
2016-02-05T02:56:04Z	_4Tus-IHFA4ErdNg32yvBQ	J_UlemBaQymI8E5btEAv5Q	4mTp-ba1gdgxrNfD_7RIQg	2	0	0	0	Have been to this location on many times this may be one of the oldest Wendy's in the city the floors are dirty the equipment is antiquated the personnel is not trained properly this may be the worst Wendy's in history	Wendy's	29778 Detroit Road	Westlake	OH	44145	13	1	Restaurants, Fast Food, Burgers	-81.9505434	41.4643225
2018-12-19T17:19:10Z	FuxoVLzUrVwJWImV3nghVg	L0GHO71vezr7QF6os4SclQ	kFqFjrJcwci9N3sSCWm7gg	1	0	0	0	Terrible and super unprofessional. Horrible service, even by McDonald's standards. I bet the people that work here think they should be making more..but cant get a simple order right. Terrible.	McDonald's	8210 Euclid Ave	Cleveland	OH	44103	13	1	Fast Food, Burgers, Restaurants, Food, Coffee & Tea	-81.6300559498	41.5030905708
2019-03-16T02:18:28Z	FuxoVLzUrVwJWImV3nghVg	ktcw9ERMWU9u3W4wRX9EqA	oRGZg9AoyC38WW8BvMhs-w	1	0	0	0	This has got to be the worst Mcdonalds I have ever been to in my whole life. Mice infestations, no ice cream, horrid customer service. For four straight years they claim the ice cream machine has been broken. Really ?? Also, they never have decaf coffee brewed. This place sucks...	McDonald's	8210 Euclid Ave	Cleveland	OH	44103	13	1	Fast Food, Burgers, Restaurants, Food, Coffee & Tea	-81.6300559498	41.5030905708
2017-01-14T02:18:26Z	wYcCWaqjikA6DnLFBthj_g	NKLGnK82iGZIEZZPj5PIUg	v4RHHwLxxv7F_oFJE8qk8Q	2	0	0	1	This location is very hit or miss, sometimes its inedible and sometimes its surprisingly good. Some of the workers seem to be very nice and attentive to their job and others seem like they shouldn't be in the food industry. Wish I could give 2 and a half stars.	Burger King	6671 Pearl Rd	Parma Heights	OH	44130	9	1	Fast Food, Restaurants, Hot Dogs, Burgers	-81.781636	41.3813214
